{
  "schema_version": "1",
  "status": "action_required",
  "summary": "The hub has changes that are not committed to Git.",
  "items": [
    {
      "id": "review_git_changes",
      "summary": "The hub has changes that are not committed to Git",
      "impact": "This local work remains pending."
    }
  ],
  "suggested_actions": [
    {
      "label": "Commit the changes of the hub",
      "command": "skillstation maintain diff"
    }
  ],
  "warnings": [],
  "error": null,
  "workspace": {
    "health": "valid",
    "index": "current",
    "git_dirty": true,
    "git_configured": true,
    "recovery_pending": false
  },
  "actions": [
    {
      "kind": "review_git_changes",
      "count": 1,
      "priority": 10,
      "summary": "The hub has changes that are not committed to Git",
      "command": "skillstation maintain diff"
    }
  ],
  "categories": [
    {
      "kind": "sources_ready_to_distill",
      "count": 0,
      "availability": "available"
    },
    {
      "kind": "candidate_lessons",
      "count": 0,
      "availability": "available"
    },
    {
      "kind": "source_unavailable",
      "count": 0,
      "availability": "available"
    },
    {
      "kind": "sources_due",
      "count": 0,
      "availability": "available"
    },
    {
      "kind": "blocking_decisions",
      "count": 0,
      "availability": "not_configured"
    },
    {
      "kind": "routing_evaluations",
      "count": 0,
      "availability": "not_configured"
    }
  ],
  "home_summary": {
    "active_skills": 1,
    "watching_sources": 0,
    "failed_or_interrupted_runs": 0,
    "pending_insights": 0,
    "pending_high_value_insights": 0,
    "attention_items": 1,
    "invalid_workspaces": 0,
    "recovery_items": 0,
    "optional_items": 0,
    "sources_due": 0,
    "unavailable_sources": 0,
    "upstream_updates": 0
  }
}

